,Title,Release Year,Genres,Rating,Votes,Story
114,Physical: 100,2023– ,"Game-Show, Reality-TV",7.7,"8,229",One hundred contestants in top physical shape compete in a series of grueling challenges to claim the honor - and cash reward - as the last one standing.
115,The Devil Judge,2021,"Crime, Drama, Mystery",8.3,"3,788","During a time of chaos, a judge turns the court into something like a reality show and punishes evil people mercilessly."
116,A Korean Odyssey,2017–2018,"Comedy, Fantasy, Horror",8.0,"5,758","In 2017, Son Oh Gong and Ma Wang are in conflict with each other and they look for a true light in a dark world where evils exists everywhere."
117,My Liberation Diary,2022,"Drama, Romance",8.3,"3,849","Three siblings, exhausted by the monotony of day-to-day adulthood, seek to find fulfillment and freedom from their humdrum lives."
118,Weightlifting Fairy Kim Bok-Joo,2016–2017,"Comedy, Romance",8.3,"11,796","A coming-of-age story about a group of college athletes who are fighting for their dreams, experiencing and finding love in the process, and growing every step of the way."
119,My Roommate Is a Gumiho,2021,"Comedy, Fantasy, Romance",7.7,"4,051","The thrilling love story of Shin Woo Yeo, a 999-years-old gumiho who wants to become human, and Lee Dam, who accidentally swallowed his fox bead."
120,The Marvelous Misadventures of Flapjack,2008–2010,"Animation, Short, Adventure",7.8,"15,620","The comical seafaring adventures of a young, enthusiastic boy, his pirate captain mentor, and the talking whale that raised him from birth."
121,Her Private Life,2019,"Comedy, Romance",7.7,"5,754","A romantic comedy about a talented gallery curator named Sung Duk Mi, who is an idol fan-girl underneath her professional veneer. Meanwhile, her boss Ryan becomes a passionate fan-boy of her."
122,Crash Course in Romance,2023,"Comedy, Drama, Romance",7.8,"3,684",Retired ex national team female handball player has become a grocery store owner in order to look after her family while she grapples with her daughter's tutor's eating disorder.
123,She Was Pretty,2015,"Comedy, Romance",7.6,"5,864","When Ji Sung-Joon was young, he was ugly. As he grew up, he began to have an attractive appearance. When Kim Hye-Jin was young, she was pretty. As she grew up, she became ugly. Ji Sung-Joon tries to find his first love."
124,Jinny's Kitchen,2023– ,Reality-TV,9.0,"3,446","Succeeding 'Youn's Kitchen', Lee Seo Jin will be running a new franchise restaurant abroad that specializes in Korean street food. The show features fellow actors Lee, Jung Yu-mi, Park Seo-joon, Choi Woo-shik and world star BTS V."
125,Another Miss Oh,2016,"Comedy, Fantasy, Romance",7.8,"2,258","A romantic television series about two women who not only share the same name Oh Hae Young but they also share a destiny with the same man, Park Do Kyung, who can see the future."
126,I'm Not a Robot,2017–2018,"Comedy, Romance, Sci-Fi",8.0,"6,694","Kim Min Gyu has wealth and success, but lives an isolated life due to his allergy of people. He then meets and falls in love with a girl who is pretending to be a robot for her ex-boyfriend, a genius robots professor."
127,Backstreet Rookie,2020,"Action, Comedy, Romance",7.5,"3,951",A former troublemaker applies for a job at a convenience store owned by the same man who ran errands for her a few years ago.
128,18 Again,2020,"Comedy, Drama, Fantasy",8.2,"2,726",A 37-year-old man on the verge of being divorced from his wife suddenly finds himself inside his 18-year-old body. He starts living a new life under a new name to get closer to his children and protect them.
129,Zombieverse,2023– ,"Comedy, Game-Show, Horror",4.4,866,"In Seoul, where a zombie virus outbreak has run amok, who will outwit the undead in the face of challenging quests and come out alive?"
130,Suspicious Partner,2017,"Comedy, Crime, Drama",7.8,"6,453","A young woman grows close to a prosecutor as she works with him as a trainee in a murder case. However, things take a turn when she inexplicably becomes a suspect."
131,Miracle Brothers,2023– ,"Drama, Mystery",7.6,546,"A mystery drama about warm friendship and humanity unfolds when Dong-joo, a passionate young man who only has debt meets Kang San, an unidentified boy with mysterious abilities."
132,Extracurricular,2020,"Crime, Drama",7.6,"8,624",A model high school student who's steeped in a world of serious crime finds his double life upended when a classmate takes an interest in his secret.
133,Beauty Inside,2018,"Drama, Fantasy, Romance",7.6,"2,770","The series tells the love story of Han Se Gye, an actress who must spend one week out of each month living in someone else's body, and Seo Do Jae, a man who suffers from Prosopagnosia."
134,Oh My Venus,2015–2016,"Comedy, Drama, Romance",7.7,"6,077",A lawyer in her thirties coming out of a long relationship decides to regain her figure and health after meeting a renowned personal trainer who obsesses with leading a healthy lifestyle after suffering a serious injury in his childhood.
135,Fight for My Way,2017,"Comedy, Romance",8.1,"8,267","Ko Dong Man, a former taekwondo champion, and Choi Ae Ra, a receptionist, struggle to follow their dreams as life throws obstacles in their path."
136,Abyss,2019,"Crime, Fantasy, Romance",7.1,"3,250","After meeting an untimely demise in separate incidents, Cha Min and Go Se-yeon discover they've come back to life in new bodies they don't recognize."
137,A Returner's Magic Should Be Special,2023– ,"Animation, Action, Adventure",7.2,77,"Just when he thinks it's the end, Desir wakes up 13 years in the past. Can he make the changes needed to save the world from destruction?"
138,The Matchmakers,2023– ,"Comedy, Romance",NaN,NaN,A story about the Joseon Dynasty's widowed husband Sim Jeong-woo and a widowed wife named Jeong Soon-deok joining forces to marry single men and women in the Joseon Dynasty.
139,Dragon Age: Absolution,2022– ,"Animation, Action, Adventure",6.4,"3,564","Set in the Tevinter Empire, the oldest of several human nations in Thedas explore the experiences of its different inhabitants."
140,Cafe Minamdang,2022– ,"Comedy, Crime, Drama",7.3,"1,563",A story about a former criminal profiler who now works as a fraudster posing as a fortune teller and the female detective who gets involved with him.
141,Run On,2020–2021,"Drama, Romance",7.4,"4,654","Veering off course from his preset path, a track star follows his own pace and heart for the first time after a film translator steps into his life"
142,Love Alarm,2019–2021,"Comedy, Drama, Romance",6.7,"7,027","In a world where an app alerts people if someone in the vicinity likes them, Kim Jojo experiences young love while coping with personal adversities."
143,Memories of the Alhambra,2018–2019,"Drama, Romance, Sci-Fi",7.8,"6,653","After suffering a setback following a friend's betrayal Yoo Jin Woo travels to Spain on a business. There, he stays at an old hostel owned by a former classical guitarist Jung Hee Joo. The two get entangled in a mysterious incident."
144,When the Weather is Fine,2020,"Drama, Romance",7.8,"1,963","A story about forgiveness, healing and love taking place around a small book store in the countryside."
145,The Penthouse: War in Life,2020–2021,"Crime, Drama, Mystery",7.9,"3,702","The story of a woman who strives to achieve her goal of entering high society by becoming the ""queen"" in the 100th floor penthouse in Gangnam, the pinnacle of success in her eyes."
146,Signal,2016,"Crime, Drama, Fantasy",8.5,"8,698",A cold-case profiler in 2015 and a detective in 1989 work together to solve a series of related murders spanning three decades using a special walkie-talkie to communicate with each other.
147,Running Man,2010– ,"Comedy, Game-Show, Reality-TV",9.1,"3,431",Running Man is a reality-variety show where the cast must complete missions at various places to win the race.
148,If You Wish Upon Me,2022– ,"Drama, Romance",8.0,"1,245","Yoon Gyeo Rye lived at an orphanage and spent time in prison. He struggles to have a normal life. He volunteers at a hospice. There, he works with volunteer team leader Kang Tae Sik and nurse Seo Yeon Joo."
149,Connect,2022,"Crime, Drama, Fantasy",6.5,"1,614",A man is kidnapped and one of his eyes removed by a gang of organs hunters and transplanted into a serial killer. The unwilling donor now has terrible visions as he witnesses terrifying attacks on the residents of Seoul.
150,Han River Police,2023– ,"Action, Comedy, Crime",6.2,121,"Stuck together on patrol of Seoul's Han River, the two officers are faced with emergency situations ranging from terrorism to everyday accidents and other incidents requiring emergency assistance."
151,Baby Shark's Big Show!,2020– ,"Animation, Short, Adventure",2.9,774,"PINKFONG's popular brand, Baby Shark, is back with a fun-filled preschool series. It follows Baby Shark and his best friend, William the fish, as they journey on comedic adventures in their community of Carnivore Cove."
152,Just Between Lovers,2017–2018,"Drama, Romance",8.2,"2,909","A major accident takes the lives of 48 people. The lives of the survivors, those who lost loved ones and those connected to the parties blamed for the tragic event are also marked forever."
153,Shooting Stars,2022,"Comedy, Drama, Romance",7.6,"2,571","Oh Han Byul leads an entertainment agency's PR team. One of her top clients is star Gong Tae Sung who does no wrong. They went to the same university, where he became her swoon enemy. They bicker but soon develop feelings for one another."
154,My ID Is Gangnam Beauty,2018,"Comedy, Romance",7.3,"5,549","Kang Mi Rae recovers her self esteem after being bullied as she gets to know Do Kyung Suk after getting plastic surgery. Then she gets called the ""Gangnam plastic surgery monster."""
155,Rookie Historian Goo Hae-Ryung,2019,"Comedy, Drama, History",8.1,"2,798","Set in the early 19th century. Goo Hae Ryung works as a historian. Female historians like Goo Hae Ryung are generally looked down upon because of their gender. Yet, Goo Hae Ryung fulfills ...                See full summary »"
156,Darkwing Duck,1991–1992,"Animation, Short, Action",7.6,"17,288",A bumbling superhero battles crime with the help of his daughter and pilot sidekick.
157,Clean with Passion for Now,2017–2019,"Comedy, Romance",7.0,"2,147","Gil Oh Sol, an employee at a cleaning company, meets Jang Sun Gyeol, the boss of the company. The two are diametric opposite when it comes to cleanliness. With the help of Oh Sol, Sun Gyeol faces his mysophobia and finds love."
158,Siren: Survive the Island,2023– ,"Game-Show, Reality-TV",8.1,"2,193","24 female police officers, firefighters, bodyguards, soldiers, athletes and stuntwomen team up by profession to compete for survival on a remote island."
159,SKY Castle,2018–2019,"Drama, Mystery",8.5,"3,820",A satirical drama that closely looks at the materialistic desires of upper-class parents in South Korea and how they ruthlessly secure the successes of their families at the cost of destroying others' lives.
160,The First Responders,2022– ,"Action, Adventure, Drama",8.0,945,An action drama about first responders involving the police and firefighters who work together in emergency situations to fight against crime and fire.
161,Doctor Cha Jeong Suk,2023– ,Drama,7.5,"1,522","It tells the story of a medical graduate turned housewife but decided to return to the medical field, and a doctor husband who maintains a perfect dual life. He is great at his job and he is also great at cheating on his wife."
162,Juvenile Justice,2022,"Crime, Drama",7.9,"4,738","A prickly judge who despises juvenile criminals arrives at a juvenile court, where she takes on a complex role examining punishment for young offenders."
163,Welcome to Waikiki,2018–2019,"Comedy, Drama",8.2,"3,010","With big dreams of financing their own film project, three struggling young men join forces in a guesthouse venture that is anything but profitable."
164,Chip 'n Dale: Rescue Rangers,1989–1990,"Animation, Action, Adventure",7.6,"21,033",Disney's fun-loving chipmunks are re-imagined as the leaders of a team of pint-sized crime-fighters.
165,One Spring Night,2019,"Drama, Romance",7.9,"3,447","A couple in their 30s has dated for many years. When they begin to discuss marriage, they begin to look upon their relationship in a different light."
166,Save Me,2017–2019,"Mystery, Thriller",7.9,"1,760",A young girl coming to a small town with her family. And through tragic events getting involved with a religious cult.
167,Cinderella and the Four Knights,2016,"Comedy, Romance",7.4,"4,897","A young girl who lives with her cruel stepmother and sister, accidentally meets 3 young and rich cousins who live a luxury life in a big mansion and is hired by the boys grandpa to look after their bad behavior."
168,Castaway Diva,2023– ,"Drama, Music",NaN,NaN,An aspiring singer who becomes stranded on a deserted island for 15 years and then commences a journey to become a diva.
169,The Little Mermaid,1992–1994,"Animation, Adventure, Comedy",6.7,"5,891",The 1989 animated feature adapted by Disney for television in a prequel that leads up to the events of the movie.
170,Those Who Read the Hearts of Evil,2022– ,"Crime, Drama, Mystery",8.0,"1,378","A crime thriller drama based on a web novel of the same name that contains the field experience of Kwon Il Yong, Korea's No. 1 profiler."
171,Love in Contract,2022– ,"Comedy, Drama, Romance",6.9,"1,047",Tells the story of a helper service that provides wives to single people needing partners to take to gatherings for married couples and school reunions.
172,Call It Love,2023,"Drama, Romance",7.7,948,"A woman thinks of revenge after her life halts at crossroads but instead starts empathizing with her mark. It's a melodrama of love, forgiveness, empathy and tragedies."
173,The New Adventures of Winnie the Pooh,1988–1991,"Animation, Short, Adventure",7.6,"4,602",Follow Winnie the Pooh's adventures in the Hundred Acre Wood.
174,TaleSpin,1990–1991,"Animation, Action, Adventure",7.5,"15,642",Baloo the Bear from The Jungle Book (1967) is cast as a 1930s Pacific Islands bush pilot.
175,The Bride of Habaek,2017,"Comedy, Fantasy, Romance",6.9,"3,648","The Water God Habaek visits earth to fulfill his mission with the help of his servant in the human world, named psychiatrist Yoon So Ah, whose ancestor have promised to serve The Water God ...                See full summary »"
176,The Sound of Magic,2022,"Drama, Fantasy, Music",7.6,"4,713","When she was little, Yun Ai dreamed of becoming a magician. But in reality, she's just a high school student who can't even afford new socks. After meeting a mysterious magician at a carnival, she decides to follow her dream."
177,Crazy Love,2022,"Comedy, Drama, Romance",7.3,"1,302","Noh Gojin, a genius who runs a private education company is conceited because of his many struggles while his current secretary, Lee Sina, who has lasted longer than anyone before, decides to get back at her boss."
178,Aladdin,1994–1995,"Animation, Action, Adventure",7.3,"12,552","Aladdin, the clever hero of Agrabah, continues his adventures with the help of his fiancee Princess Jasmine, his pet monkey Abu, Magic Carpet, Iago the greedy parrot, and of course his best friend the semi-cosmic Genie."
179,Love in the Moonlight,1996–2016,"Comedy, Drama, History",7.8,"3,849",The unlikely love story between a crown prince and his eunuch.
180,Prison Playbook,2017–2018,"Comedy, Drama",8.4,"4,391","Baseball pitcher Kim Je-hyeok becomes a convict overnight after being sent to prison for defending his sister from a sexual assault, days before he was due to fly to the US to join the Boston Red Sox."
181,Hercules,1998–1999,"Animation, Action, Adventure",6.6,"10,977","This spin-off of Disney's Hercules (1997) follows Hercules' many labors during the years he spent training how to be a hero under the tutelage of satyr Philoctetes. Olympian Gods and Goddesses, as well as Hades and Pegasus, often visit him."
182,The World of the Married,2020,"Drama, Romance",8.0,"3,226",A story about a married couple whose betrayal of one another leads to a whirlwind of revenge.
183,Bee & Puppycat: Lazy in Space,2022– ,"Animation, Comedy, Sci-Fi",8.5,743,The second season of beloved web series Bee and PuppyCat after a nearly five year break. The season picks back up the cheerful 22-year old Bee and intergalactic space warrior for a set of adventures.
184,"Link: Eat, Love, Kill",2022,"Crime, Drama, Fantasy",7.3,"1,318",A crime mystery thriller fantasy about a man and woman sharing same emotions. Gye Hoon is a chef whose twin sister went missing. Now he finds his random emotions connected with a girl named Da Hyun.
185,My Country: The New Age,2019,"Action, Drama, History",8.1,"2,350","Set during the end of the Goryeo period to the early Joseon period. Two friends aim their swords against one another due to differences in opinion about ""my country."""
186,Blind,2022,"Drama, Mystery, Thriller",8.0,"1,050","A homicide squad detective, suspected of serial murder, searches for the real culprit."
187,Oh My Ghost,2015,"Comedy, Drama, Fantasy",8.0,"4,952","Timid Na Bong Sun gets possessed by the ghost of a confident young woman who seeks to solve her one unfinished business by hooking up with Bong Sun's boss, famous chef Kang Sun Woo."
188,The Girl Downstairs,2023,"Comedy, Drama, Romance",8.1,143,"Freshman Juntang Yuan applies for Minsong University to get close to his senior crush, Zhu Zhu. After enrolling, he meets Shiya Li, a former idol who had dropped out. He also engages Ruoni ...                See full summary »"
189,Pinocchio,2014–2015,"Comedy, Drama, Mystery",8.1,"8,414","A young boy, whose life and family has been destroyed by new media, gets adopted by a family in a rural area after being found lost at sea. He conceals his past for 13 years. But then the girl he loves, a reporter, finds out the truth."
190,Black,2017,"Crime, Drama, Fantasy",7.8,"4,410",A man possessed by death. A woman who can see death. The earthly and the afterworld collide dangerously.
191,The Secret Romantic Guesthouse,2023– ,"Drama, History, Romance",7.3,300,"A work about an incident that takes place when the owners of the boarding house called 'Guest Summer Palace', which breaks stereotypes, and boarders with secrets gather to find Lee Seol who disappeared 13 years ago."
192,Anna,2022– ,Drama,7.5,888,"Yoo Mi is the woman who tells a small lie and ends up living someone else's life. Hyun Joo is a woman who lives her life holding herself above everyone, treating them with neither kindness ...                See full summary »"
193,The Queen's Umbrella,2022,"Comedy, Drama",8.5,"2,261","Im Hwa Ryeong, a prickly, sensitive, and hot-tempered queen, tries to turn her trouble making princes into proper crown princes."
194,Hi Cookie,2023– ,"Drama, Fantasy, Mystery",NaN,NaN,A drama about what happens when a dangerous handmade cookie that fulfills a dream devours an elite high school.
195,Jumong,2006–2007,"Biography, Drama, History",8.1,"3,730","An epic based on the myth of Jumong, founder of the ancient Korean kingdom of Goguryeo in 37 B.C."
196,Sijipeuseu: The Myth,2021,"Action, Drama, Fantasy",7.0,"4,677","An unfathomable incident introduces a genius engineer to dangerous secrets of the world, and to a woman from the future who's come looking for him."
197,Yumi's Cells,2021– ,"Comedy, Drama, Romance",8.2,"2,562","The story of an ordinary office worker named Yumi-from the point of view of the many brain cells in her head controlling her every thought, feeling, and action."
198,Secret Garden,2010–2011,"Comedy, Drama, Fantasy",8.1,"7,367","A rich young CEO falls for a poor stuntwoman despite class differences, cultural traditions and the man's firmly objecting mother."
199,Record of Youth,2020,"Drama, Romance",7.2,"3,082",Two actors and a makeup artist fight to make their own way in a world that weighs the backgrounds they were born into more than their dreams.
